Title,URL,Description,Details,ShortDetails,Resource,Type,Identifiers,Db,EntrezUID,Properties
"Alteration of Gene Expression, DNA Methylation, and Histone Methylation in Free Radical Scavenging Networks in Adult Mouse Hippocampus following Fetal Alcohol Exposure.","/pubmed/27136348","Chater-Diehl EJ, Laufer BI, Castellani CA, Alberry BL, Singh SM.","PLoS One. 2016 May 2;11(5):e0154836. doi: 10.1371/journal.pone.0154836.","PLoS One.  2016","PubMed","citation","PMID:27136348 | PMCID:PMC4852908","pubmed","27136348","create date:2016/05/03 | first author:Chater-Diehl EJ",
"Comparative analysis of circulating tumor DNA stability In K(3)EDTA, Streck, and CellSave blood collection tubes.","/pubmed/27129799","Kang Q, Henry NL, Paoletti C, Jiang H, Vats P, Chinnaiyan AM, Hayes DF, Merajver SD, Rae JM, Tewari M.","Clin Biochem. 2016 Dec;49(18):1354-1360. doi: 10.1016/j.clinbiochem.2016.03.012.","Clin Biochem.  2016","PubMed","citation","PMID:27129799","pubmed","27129799","create date:2016/05/01 | first author:Kang Q",
"Highly sensitive stool DNA testing of Fusobacterium nucleatum as a marker for detection of colorectal tumours in a Japanese population.","/pubmed/27126270","Suehiro Y, Sakai K, Nishioka M, Hashimoto S, Takami T, Higaki S, Shindo Y, Hazama S, Oka M, Nagano H, Sakaida I, Yamasaki T.","Ann Clin Biochem. 2017 Jan;54(1):86-91. doi: 10.1177/0004563216643970.","Ann Clin Biochem.  2017","PubMed","citation","PMID:27126270","pubmed","27126270","create date:2016/04/30 | first author:Suehiro Y",
"NIPBL expression levels in CdLS probands as a predictor of mutation type and phenotypic severity.","/pubmed/27125329","Kaur M, Mehta D, Noon SE, Deardorff MA, Zhang Z, Krantz ID.","Am J Med Genet C Semin Med Genet. 2016 Jun;172(2):163-70. doi: 10.1002/ajmg.c.31495.","Am J Med Genet C Semin Med Genet.  2016","PubMed","citation","PMID:27125329","pubmed","27125329","create date:2016/04/30 | first author:Kaur M",
"Digital PCR methods improve detection sensitivity and measurement precision of low abundance mtDNA deletions.","/pubmed/27122135","Belmonte FR, Martin JL, Frescura K, Damas J, Pereira F, Tarnopolsky MA, Kaufman BA.","Sci Rep. 2016 Apr 28;6:25186. doi: 10.1038/srep25186.","Sci Rep.  2016","PubMed","citation","PMID:27122135 | PMCID:PMC4848546","pubmed","27122135","create date:2016/04/29 | first author:Belmonte FR",
"Tumor Content Chart-Assisted HER2/CEP17 Digital PCR Analysis of Gastric Cancer Biopsy Specimens.","/pubmed/27119558","Matsusaka K, Ishikawa S, Nakayama A, Ushiku T, Nishimoto A, Urabe M, Kaneko N, Kunita A, Kaneda A, Aburatani H, Fujishiro M, Seto Y, Fukayama M.","PLoS One. 2016 Apr 27;11(4):e0154430. doi: 10.1371/journal.pone.0154430. eCollection 2016 Apr 27.","PLoS One.  2016","PubMed","citation","PMID:27119558 | PMCID:PMC4847903","pubmed","27119558","create date:2016/04/28 | first author:Matsusaka K",
"Utility of KRAS mutation detection using circulating cell-free DNA from patients with colorectal cancer.","/pubmed/27116474","Yamada T, Iwai T, Takahashi G, Kan H, Koizumi M, Matsuda A, Shinji S, Yamagishi A, Yokoyama Y, Tatsuguchi A, Kawagoe T, Kitano S, Nakayama M, Matsumoto S, Uchida E.","Cancer Sci. 2016 Jul;107(7):936-43. doi: 10.1111/cas.12959.","Cancer Sci.  2016","PubMed","citation","PMID:27116474 | PMCID:PMC4946708","pubmed","27116474","create date:2016/04/27 | first author:Yamada T",
"Phylogeny of Geminivirus Coat Protein Sequences and Digital PCR Aid in Identifying Spissistilus festinus as a Vector of Grapevine red blotch-associated virus.","/pubmed/27111804","Bahder BW, Zalom FG, Jayanth M, Sudarshana MR.","Phytopathology. 2016 Oct;106(10):1223-1230.","Phytopathology.  2016","PubMed","citation","PMID:27111804","pubmed","27111804","create date:2016/04/26 | first author:Bahder BW",
"Development and evaluation of a secondary reference panel for BCR-ABL1 quantification on the International Scale.","/pubmed/27109508","Cross NC, White HE, Ernst T, Welden L, Dietz C, Saglio G, Mahon FX, Wong CC, Zheng D, Wong S, Wang SS, Akiki S, Albano F, Andrikovics H, Anwar J, Balatzenko G, Bendit I, Beveridge J, Boeckx N, Cerveira N, Cheng SM, Colomer D, et al.","Leukemia. 2016 Sep;30(9):1844-52. doi: 10.1038/leu.2016.90.","Leukemia.  2016","PubMed","citation","PMID:27109508 | PMCID:PMC5240017","pubmed","27109508","create date:2016/04/26 | first author:Cross NC",
"Absolute quantification reveals the stable transmission of a high copy number variant linked to autoinflammatory disease.","/pubmed/27107962","Olsson M, Kierczak M, Karlsson Å, Jabłońska J, Leegwater P, Koltookian M, Abadie J, De Citres CD, Thomas A, Hedhammar Å, Tintle L, Lindblad-Toh K, Meadows JR.","BMC Genomics. 2016 Apr 23;17:299. doi: 10.1186/s12864-016-2619-0.","BMC Genomics.  2016","PubMed","citation","PMID:27107962 | PMCID:PMC4841964","pubmed","27107962","create date:2016/04/25 | first author:Olsson M",
"Transcriptome and metabolome analysis in shoot and root of Valeriana fauriei.","/pubmed/27107812","Park YJ, Li X, Noh SJ, Kim JK, Lim SS, Park NI, Kim S, Kim YB, Kim YO, Lee SW, Arasu MV, Al-Dhabi NA, Park SU.","BMC Genomics. 2016 Apr 23;17:303. doi: 10.1186/s12864-016-2616-3.","BMC Genomics.  2016","PubMed","citation","PMID:27107812 | PMCID:PMC4842265","pubmed","27107812","create date:2016/04/25 | first author:Park YJ",
"Analysis of differentially expressed genes between fluoride-sensitive and fluoride-endurable individuals in midgut of silkworm, Bombyx mori.","/pubmed/27106117","Qian H, Li G, He Q, Zhang H, Xu A.","Gene. 2016 Aug 15;588(1):47-53. doi: 10.1016/j.gene.2016.04.033.","Gene.  2016","PubMed","citation","PMID:27106117","pubmed","27106117","create date:2016/04/24 | first author:Qian H",
"Clinical significance of monitoring ESR1 mutations in circulating cell-free DNA in estrogen receptor positive breast cancer patients.","/pubmed/27102299","Takeshita T, Yamamoto Y, Yamamoto-Ibusuki M, Inao T, Sueta A, Fujiwara S, Omoto Y, Iwase H.","Oncotarget. 2016 May 31;7(22):32504-18. doi: 10.18632/oncotarget.8839.","Oncotarget.  2016","PubMed","citation","PMID:27102299 | PMCID:PMC5078029","pubmed","27102299","create date:2016/04/23 | first author:Takeshita T",
"A Digital PCR-Based Method for Efficient and Highly Specific Screening of Genome Edited Cells.","/pubmed/27089539","Findlay SD, Vincent KM, Berman JR, Postovit LM.","PLoS One. 2016 Apr 18;11(4):e0153901. doi: 10.1371/journal.pone.0153901.","PLoS One.  2016","PubMed","citation","PMID:27089539 | PMCID:PMC4835065","pubmed","27089539","create date:2016/04/19 | first author:Findlay SD",
"MicroRNA-29a: A potential biomarker in the development of intracranial aneurysm.","/pubmed/27084222","Wang WH, Wang YH, Zheng LL, Li XW, Hao F, Guo D.","J Neurol Sci. 2016 May 15;364:84-9. doi: 10.1016/j.jns.2016.03.010.","J Neurol Sci.  2016","PubMed","citation","PMID:27084222","pubmed","27084222","create date:2016/04/17 | first author:Wang WH",
"Fetal Genotyping in Maternal Blood by Digital PCR: Towards NIPD of Monogenic Disorders Independently of Parental Origin.","/pubmed/27078875","Perlado S, Bustamante-Aragonés A, Donas M, Lorda-Sánchez I, Plaza J, Rodríguez de Alba M.","PLoS One. 2016 Apr 14;11(4):e0153258. doi: 10.1371/journal.pone.0153258.","PLoS One.  2016","PubMed","citation","PMID:27078875 | PMCID:PMC4831728","pubmed","27078875","create date:2016/04/15 | first author:Perlado S",
"Assessing Specificity of Anticancer Drugs In Vitro.","/pubmed/27078035","Kluwe L.","J Vis Exp. 2016 Mar 23;(109):e53752. doi: 10.3791/53752.","J Vis Exp.  2016","PubMed","citation","PMID:27078035 | PMCID:PMC4841310","pubmed","27078035","create date:2016/04/15 | first author:Kluwe L",
"Optimization of digital droplet polymerase chain reaction for quantification of genetically modified organisms.","/pubmed/27077048","Gerdes L, Iwobi A, Busch U, Pecoraro S.","Biomol Detect Quantif. 2016 Jan 7;7:9-20. doi: 10.1016/j.bdq.2015.12.003.","Biomol Detect Quantif.  2016","PubMed","citation","PMID:27077048 | PMCID:PMC4827695","pubmed","27077048","create date:2016/04/15 | first author:Gerdes L",
"qPCR, dPCR, NGS - A journey.","/pubmed/27077031","Huggett JF, O'Grady J, Bustin S.","Biomol Detect Quantif. 2015 Jan 15;3:A1-5. doi: 10.1016/j.bdq.2015.01.001. No abstract available. ","Biomol Detect Quantif.  2015","PubMed","citation","PMID:27077031 | PMCID:PMC4822211","pubmed","27077031","create date:2016/04/15 | first author:Huggett JF",
"Quantitative Assessment of Commutability for Clinical Viral Load Testing Using a Digital PCR-Based Reference Standard.","/pubmed/27076654","Tang L, Sun Y, Buelow D, Gu Z, Caliendo AM, Pounds S, Hayden RT.","J Clin Microbiol. 2016 Jun;54(6):1616-23. doi: 10.1128/JCM.03346-15.","J Clin Microbiol.  2016","PubMed","citation","PMID:27076654 | PMCID:PMC4879274","pubmed","27076654","create date:2016/04/15 | first author:Tang L",
"Application of Droplet Digital PCR to Validate Rift Valley Fever Vaccines.","/pubmed/27076132","Ly HJ, Lokugamage N, Ikegami T.","Methods Mol Biol. 2016;1403:207-20. doi: 10.1007/978-1-4939-3387-7_10.","Methods Mol Biol.  2016","PubMed","citation","PMID:27076132","pubmed","27076132","create date:2016/04/15 | first author:Ly HJ",
"Characterization of Glycolytic Pathway Genes Using RNA-Seq in Developing Kernels of Eucommia ulmoides.","/pubmed/27074598","Feng Y, Zhang L, Fu J, Li F, Wang L, Tan X, Mo W, Cao H.","J Agric Food Chem. 2016 May 11;64(18):3712-31. doi: 10.1021/acs.jafc.5b05918.","J Agric Food Chem.  2016","PubMed","citation","PMID:27074598","pubmed","27074598","create date:2016/04/14 | first author:Feng Y",
"Mutant DNA quantification by digital PCR can be confounded by heating during DNA fragmentation.","/pubmed/27071606","Kang Q, Parkin B, Giraldez MD, Tewari M.","Biotechniques. 2016 Apr 1;60(4):175-6, 178, 180 passim. doi: 10.2144/000114401.","Biotechniques.  2016","PubMed","citation","PMID:27071606","pubmed","27071606","create date:2016/04/14 | first author:Kang Q",
"Risk stratification of T-cell Acute Lymphoblastic Leukemia patients based on gene expression, mutations and copy number variation.","/pubmed/27070758","Mirji G, Bhat J, Kode J, Banavali S, Sengar M, Khadke P, Sait O, Chiplunkar S.","Leuk Res. 2016 Jun;45:33-9. doi: 10.1016/j.leukres.2016.03.002.","Leuk Res.  2016","PubMed","citation","PMID:27070758","pubmed","27070758","create date:2016/04/14 | first author:Mirji G",
"Synovial Sarcoma Microvesicles Harbor the SYT-SSX Fusion Gene Transcript: Comparison of Different Methods of Detection and Implications in Biomarker Research.","/pubmed/27069481","Fricke A, Ullrich PV, Cimniak AF, Follo M, Nestel S, Heimrich B, Nazarenko I, Stark GB, Bannasch H, Braig D, Eisenhardt SU.","Stem Cells Int. 2016;2016:6146047. doi: 10.1155/2016/6146047.","Stem Cells Int.  2016","PubMed","citation","PMID:27069481 | PMCID:PMC4812493","pubmed","27069481","create date:2016/04/14 | first author:Fricke A",
"Complex Copy Number Variation of AMY1 does not Associate with Obesity in two East Asian Cohorts.","/pubmed/27068483","Yong RY, Mustaffa SB, Wasan PS, Sheng L, Marshall CR, Scherer SW, Teo YY, Yap EP.","Hum Mutat. 2016 Jul;37(7):669-78. doi: 10.1002/humu.22996.","Hum Mutat.  2016","PubMed","citation","PMID:27068483","pubmed","27068483","create date:2016/04/14 | first author:Yong RY",
"Droplet digital PCR and qRT-PCR to detect circulating miR-21 in laryngeal squamous cell carcinoma and pre-malignant laryngeal lesions.","/pubmed/27067271","Wei L, Mao M, Liu H.","Acta Otolaryngol. 2016 Sep;136(9):923-32. doi: 10.3109/00016489.2016.1165862.","Acta Otolaryngol.  2016","PubMed","citation","PMID:27067271","pubmed","27067271","create date:2016/04/14 | first author:Wei L",
"Accurate quantification of supercoiled DNA by digital PCR.","/pubmed/27063649","Dong L, Yoo HB, Wang J, Park SR.","Sci Rep. 2016 Apr 11;6:24230. doi: 10.1038/srep24230.","Sci Rep.  2016","PubMed","citation","PMID:27063649 | PMCID:PMC4827127","pubmed","27063649","create date:2016/04/12 | first author:Dong L",
"Droplet digital PCR quantifies host inflammatory transcripts in feces reliably and reproducibly.","/pubmed/27063479","Stauber J, Shaikh N, Ordiz MI, Tarr PI, Manary MJ.","Cell Immunol. 2016 May;303:43-9. doi: 10.1016/j.cellimm.2016.03.007.","Cell Immunol.  2016","PubMed","citation","PMID:27063479 | PMCID:PMC4863679","pubmed","27063479","create date:2016/04/12 | first author:Stauber J",
"[Interaction Between Occupational Vanadium Exposure and hsp70-hom on Neurobehavioral Function].","/pubmed/27062781","Zhang Q, Liu YX, Cui L, Li SP, Gao W, Hu GL, Zhang ZH, Lan YJ.","Sichuan Da Xue Xue Bao Yi Xue Ban. 2016 Jan;47(1):49-53, 59. Chinese. ","Sichuan Da Xue Xue Bao Yi Xue Ban.  2016","PubMed","citation","PMID:27062781","pubmed","27062781","create date:2016/04/12 | first author:Zhang Q",
"A Quantitative Analysis of Subclonal and Clonal Gene Mutations before and after Therapy in Chronic Lymphocytic Leukemia.","/pubmed/27060156","Amin NA, Seymour E, Saiya-Cork K, Parkin B, Shedden K, Malek SN.","Clin Cancer Res. 2016 Sep 1;22(17):4525-35. doi: 10.1158/1078-0432.CCR-15-3103.","Clin Cancer Res.  2016","PubMed","citation","PMID:27060156 | PMCID:PMC5010528","pubmed","27060156","create date:2016/04/10 | first author:Amin NA",
"Simple, multiplexed, PCR-based barcoding of DNA enables sensitive mutation detection in liquid biopsies using sequencing.","/pubmed/27060140","Ståhlberg A, Krzyzanowski PM, Jackson JB, Egyud M, Stein L, Godfrey TE.","Nucleic Acids Res. 2016 Jun 20;44(11):e105. doi: 10.1093/nar/gkw224.","Nucleic Acids Res.  2016","PubMed","citation","PMID:27060140 | PMCID:PMC4914102","pubmed","27060140","create date:2016/04/10 | first author:Ståhlberg A",
"Dynamic quantification of avian influenza H7N9(A) virus in a human infection during clinical treatment using droplet digital PCR.","/pubmed/27058642","Yan Y, Jia XJ, Wang HH, Fu XF, Ji JM, He PY, Chen LX, Luo JY, Chen ZW.","J Virol Methods. 2016 Aug;234:22-7. doi: 10.1016/j.jviromet.2016.04.001.","J Virol Methods.  2016","PubMed","citation","PMID:27058642","pubmed","27058642","create date:2016/04/09 | first author:Yan Y",
"Somatic Activating Mutations in GNAQ and GNA11 Are Associated with Congenital Hemangioma.","/pubmed/27058448","Ayturk UM, Couto JA, Hann S, Mulliken JB, Williams KL, Huang AY, Fishman SJ, Boyd TK, Kozakewich HP, Bischoff J, Greene AK, Warman ML.","Am J Hum Genet. 2016 Apr 7;98(4):789-95. doi: 10.1016/j.ajhg.2016.03.009.","Am J Hum Genet.  2016","PubMed","citation","PMID:27058448 | PMCID:PMC4833432","pubmed","27058448","create date:2016/04/09 | first author:Ayturk UM",
"Prospective Validation of Rapid Plasma Genotyping for the Detection of EGFR and KRAS Mutations in Advanced Lung Cancer.","/pubmed/27055085","Sacher AG, Paweletz C, Dahlberg SE, Alden RS, O'Connell A, Feeney N, Mach SL, Jänne PA, Oxnard GR.","JAMA Oncol. 2016 Aug 1;2(8):1014-22. doi: 10.1001/jamaoncol.2016.0173. Erratum in: JAMA Oncol. 2016 Aug 1;2(8):1099. ","JAMA Oncol.  2016","PubMed","citation","PMID:27055085 | PMCID:PMC4982795","pubmed","27055085","create date:2016/04/08 | first author:Sacher AG",
"Current approaches to assess HIV-1 persistence.","/pubmed/27054279","Banga R, Procopio FA, Perreau M.","Curr Opin HIV AIDS. 2016 Jul;11(4):424-31. doi: 10.1097/COH.0000000000000282.","Curr Opin HIV AIDS.  2016","PubMed","citation","PMID:27054279","pubmed","27054279","create date:2016/04/08 | first author:Banga R",
"Comparison of DNA Quantification Methods for Next Generation Sequencing.","/pubmed/27048884","Robin JD, Ludlow AT, LaRanger R, Wright WE, Shay JW.","Sci Rep. 2016 Apr 6;6:24067. doi: 10.1038/srep24067.","Sci Rep.  2016","PubMed","citation","PMID:27048884 | PMCID:PMC4822169","pubmed","27048884","create date:2016/04/07 | first author:Robin JD",
"De novo Sequencing of the Leaf Transcriptome Reveals Complex Light-Responsive Regulatory Networks in Camellia sinensis cv. Baijiguan.","/pubmed/27047513","Wu Q, Chen Z, Sun W, Deng T, Chen M.","Front Plant Sci. 2016 Mar 21;7:332. doi: 10.3389/fpls.2016.00332.","Front Plant Sci.  2016","PubMed","citation","PMID:27047513 | PMCID:PMC4801010","pubmed","27047513","create date:2016/04/06 | first author:Wu Q",
"Genomic Aberrations in Crizotinib Resistant Lung Adenocarcinoma Samples Identified by Transcriptome Sequencing.","/pubmed/27045755","Saber A, van der Wekken AJ, Kok K, Terpstra MM, Bosman LJ, Mastik MF, Timens W, Schuuring E, Hiltermann TJ, Groen HJ, van den Berg A.","PLoS One. 2016 Apr 5;11(4):e0153065. doi: 10.1371/journal.pone.0153065.","PLoS One.  2016","PubMed","citation","PMID:27045755 | PMCID:PMC4821611","pubmed","27045755","create date:2016/04/06 | first author:Saber A",
"KRAS G12V Mutation Detection by Droplet Digital PCR in Circulating Cell-Free DNA of Colorectal Cancer Patients.","/pubmed/27043547","Olmedillas López S, García-Olmo DC, García-Arranz M, Guadalajara H, Pastor C, García-Olmo D.","Int J Mol Sci. 2016 Apr 1;17(4):484. doi: 10.3390/ijms17040484.","Int J Mol Sci.  2016","PubMed","citation","PMID:27043547 | PMCID:PMC4848940","pubmed","27043547","create date:2016/04/05 | first author:Olmedillas López S",
Title,URL,Description,Details,ShortDetails,Resource,Type,Identifiers,Db,EntrezUID,Properties
"Initial Diagnosis of ALK-Positive Non-Small-Cell Lung Cancer Based on Analysis of ALK Status Utilizing Droplet Digital PCR.","/pubmed/27043019","Lund HL, Hughesman CB, Fakhfakh K, McNeil K, Clemens S, Hocken K, Pettersson R, Karsan A, Foster LJ, Haynes C.","Anal Chem. 2016 May 3;88(9):4879-85. doi: 10.1021/acs.analchem.6b00707.","Anal Chem.  2016","PubMed","citation","PMID:27043019","pubmed","27043019","create date:2016/04/05 | first author:Lund HL",
"Detection and Isolation of Digital Dermatitis Treponemes from Bovine Pressure Sores.","/pubmed/27040650","Clegg SR, Crosby-Durrani HE, Bell J, Blundell R, Blowey RW, Carter SD, Evans NJ.","J Comp Pathol. 2016 May;154(4):273-82. doi: 10.1016/j.jcpa.2016.02.006.","J Comp Pathol.  2016","PubMed","citation","PMID:27040650","pubmed","27040650","create date:2016/04/05 | first author:Clegg SR",
"Nanofluidic Digital PCR and Extended Genotyping of RAS and BRAF for Improved Selection of Metastatic Colorectal Cancer Patients for Anti-EGFR Therapies.","/pubmed/27037411","Azuara D, Santos C, Lopez-Doriga A, Grasselli J, Nadal M, Sanjuan X, Marin F, Vidal J, Montal R, Moreno V, Bellosillo B, Argiles G, Elez E, Dienstmann R, Montagut C, Tabernero J, Capellá G, Salazar R.","Mol Cancer Ther. 2016 May;15(5):1106-12. doi: 10.1158/1535-7163.MCT-15-0820.","Mol Cancer Ther.  2016","PubMed","citation","PMID:27037411","pubmed","27037411","create date:2016/04/03 | first author:Azuara D",
"Colony-stimulating factor (CSF) 1 receptor blockade reduces inflammation in human and murine models of rheumatoid arthritis.","/pubmed/27036883","Garcia S, Hartkamp LM, Malvar-Fernandez B, van Es IE, Lin H, Wong J, Long L, Zanghi JA, Rankin AL, Masteller EL, Wong BR, Radstake TR, Tak PP, Reedquist KA.","Arthritis Res Ther. 2016 Mar 31;18:75. doi: 10.1186/s13075-016-0973-6.","Arthritis Res Ther.  2016","PubMed","citation","PMID:27036883 | PMCID:PMC4818474","pubmed","27036883","create date:2016/04/03 | first author:Garcia S",
"A Novel Urine Exosome Gene Expression Assay to Predict High-grade Prostate Cancer at Initial Biopsy.","/pubmed/27032035","McKiernan J, Donovan MJ, O'Neill V, Bentink S, Noerholm M, Belzer S, Skog J, Kattan MW, Partin A, Andriole G, Brown G, Wei JT, Thompson IM Jr, Carroll P.","JAMA Oncol. 2016 Jul 1;2(7):882-9. doi: 10.1001/jamaoncol.2016.0097.","JAMA Oncol.  2016","PubMed","citation","PMID:27032035","pubmed","27032035","create date:2016/04/01 | first author:McKiernan J",
"Systematic quantification of HDR and NHEJ reveals effects of locus, nuclease, and cell type on genome-editing.","/pubmed/27030102","Miyaoka Y, Berman JR, Cooper SB, Mayerl SJ, Chan AH, Zhang B, Karlin-Neumann GA, Conklin BR.","Sci Rep. 2016 Mar 31;6:23549. doi: 10.1038/srep23549.","Sci Rep.  2016","PubMed","citation","PMID:27030102 | PMCID:PMC4814844","pubmed","27030102","create date:2016/04/01 | first author:Miyaoka Y",
"Development of real-time reverse transcriptase qPCR assays for the detection of Punta Toro virus and Pichinde virus.","/pubmed/27029488","Stefan CP, Chase K, Coyne S, Kulesh DA, Minogue TD, Koehler JW.","Virol J. 2016 Mar 31;13:54. doi: 10.1186/s12985-016-0509-3.","Virol J.  2016","PubMed","citation","PMID:27029488 | PMCID:PMC4815133","pubmed","27029488","create date:2016/04/01 | first author:Stefan CP",
"Expression of cell cycle markers is predictive of the response to primary systemic therapy of locally advanced breast cancer.","/pubmed/27026269","Tőkés T, Tőkés AM, Szentmártoni G, Kiszner G, Madaras L, Kulka J, Krenács T, Dank M.","Virchows Arch. 2016 Jun;468(6):675-86. doi: 10.1007/s00428-016-1925-x.","Virchows Arch.  2016","PubMed","citation","PMID:27026269","pubmed","27026269","create date:2016/03/31 | first author:Tőkés T",
"A Duplex Digital PCR Assay for Simultaneous Quantification of the Enterococcus spp. and the Human Fecal-associated HF183 Marker in Waters.","/pubmed/27023488","Cao Y, Raith MR, Griffith JF.","J Vis Exp. 2016 Mar 9;(109). doi: 10.3791/53611.","J Vis Exp.  2016","PubMed","citation","PMID:27023488","pubmed","27023488","create date:2016/03/31 | first author:Cao Y",
"Optimisation of a droplet digital PCR assay for the diagnosis of Schistosoma japonicum infection: A duplex approach with DNA binding dye chemistry.","/pubmed/27021661","Weerakoon KG, Gordon CA, Gobert GN, Cai P, McManus DP.","J Microbiol Methods. 2016 Jun;125:19-27. doi: 10.1016/j.mimet.2016.03.012.","J Microbiol Methods.  2016","PubMed","citation","PMID:27021661","pubmed","27021661","create date:2016/03/30 | first author:Weerakoon KG",
"Development and application of absolute quantitative detection by duplex chamber-based digital PCR of genetically modified maize events without pretreatment steps.","/pubmed/27016439","Zhu P, Fu W, Wang C, Du Z, Huang K, Zhu S, Xu W.","Anal Chim Acta. 2016 Apr 15;916:60-6. doi: 10.1016/j.aca.2016.02.020.","Anal Chim Acta.  2016","PubMed","citation","PMID:27016439","pubmed","27016439","create date:2016/03/27 | first author:Zhu P",
"Digital PCR using micropatterned superporous absorbent array chips.","/pubmed/27010726","Wang Y, Southard KM, Zeng Y.","Analyst. 2016 Jun 21;141(12):3821-31. doi: 10.1039/c6an00164e.","Analyst.  2016","PubMed","citation","PMID:27010726 | PMCID:PMC4899130","pubmed","27010726","create date:2016/03/25 | first author:Wang Y",
"BRAF mutations in conjunctival melanoma: investigation of incidence, clinicopathological features, prognosis and paired premalignant lesions.","/pubmed/27009410","Larsen AC, Dahl C, Dahmcke CM, Lade-Keller J, Siersma VD, Toft PB, Coupland SE, Prause JU, Guldberg P, Heegaard S.","Acta Ophthalmol. 2016 Aug;94(5):463-70. doi: 10.1111/aos.13007.","Acta Ophthalmol.  2016","PubMed","citation","PMID:27009410","pubmed","27009410","create date:2016/03/25 | first author:Larsen AC",
"Tumour necrosis factor α polymorphism (TNF-308α G/A) in association with asthma related phenotypes and air pollutants among children in KwaZulu-Natal.","/pubmed/27001655","Makamure MT, Reddy P, Chuturgoon A, Naidoo RN, Mentz G, Batterman S, Robins TG.","Asian Pac J Allergy Immunol. 2016 Sep;34(3):217-222.","Asian Pac J Allergy Immunol.  2016","PubMed","citation","PMID:27001655","pubmed","27001655","create date:2016/03/24 | first author:Makamure MT",
"A Novel Pretreatment-Free Duplex Chamber Digital PCR Detection System for the Absolute Quantitation of GMO Samples.","/pubmed/26999129","Zhu P, Wang C, Huang K, Luo Y, Xu W.","Int J Mol Sci. 2016 Mar 18;17(3):402. doi: 10.3390/ijms17030402.","Int J Mol Sci.  2016","PubMed","citation","PMID:26999129 | PMCID:PMC4813257","pubmed","26999129","create date:2016/03/22 | first author:Zhu P",
"Digital Quantification of Proteins and mRNA in Single Mammalian Cells.","/pubmed/26990994","Albayrak C, Jordi CA, Zechner C, Lin J, Bichsel CA, Khammash M, Tay S.","Mol Cell. 2016 Mar 17;61(6):914-24. doi: 10.1016/j.molcel.2016.02.030.","Mol Cell.  2016","PubMed","citation","PMID:26990994","pubmed","26990994","create date:2016/03/19 | first author:Albayrak C",
"Detection of human papillomavirus type 16 in oropharyngeal squamous cell carcinoma using droplet digital polymerase chain reaction.","/pubmed/26989832","Biron VL, Kostiuk M, Isaac A, Puttagunta L, O'Connell DA, Harris J, Côté DW, Seikaly H.","Cancer. 2016 May 15;122(10):1544-51. doi: 10.1002/cncr.29976.","Cancer.  2016","PubMed","citation","PMID:26989832","pubmed","26989832","create date:2016/03/19 | first author:Biron VL",
"Quantification of mutant alleles in circulating tumor DNA can predict survival in lung cancer.","/pubmed/26989078","Yang X, Zhuo M, Ye X, Bai H, Wang Z, Sun Y, Zhao J, An T, Duan J, Wu M, Wang J.","Oncotarget. 2016 Apr 12;7(15):20810-24. doi: 10.18632/oncotarget.8021.","Oncotarget.  2016","PubMed","citation","PMID:26989078 | PMCID:PMC4991494","pubmed","26989078","create date:2016/03/19 | first author:Yang X",
"Circulating Plasma Tumor DNA.","/pubmed/26987539","Parsons HA, Beaver JA, Park BH.","Adv Exp Med Biol. 2016;882:259-76. doi: 10.1007/978-3-319-22909-6_11. Review.","Adv Exp Med Biol.  2016","PubMed","citation","PMID:26987539","pubmed","26987539","create date:2016/03/19 | first author:Parsons HA",
"Age-Related and Heteroplasmy-Related Variation in Human mtDNA Copy Number.","/pubmed/26978189","Wachsmuth M, Hübner A, Li M, Madea B, Stoneking M.","PLoS Genet. 2016 Mar 15;12(3):e1005939. doi: 10.1371/journal.pgen.1005939.","PLoS Genet.  2016","PubMed","citation","PMID:26978189 | PMCID:PMC4792396","pubmed","26978189","create date:2016/03/16 | first author:Wachsmuth M",
