Title,URL,Description,Details,ShortDetails,Resource,Type,Identifiers,Db,EntrezUID,Properties
"Accurate quantification of episomal HIV-1 two-long terminal repeat circles by use of optimized DNA isolation and droplet digital PCR.","/pubmed/25502524","Malatinkova E, Kiselinova M, Bonczkowski P, Trypsteen W, Messiaen P, Vermeire J, Verhasselt B, Vervisch K, Vandekerckhove L, De Spiegelaere W.","J Clin Microbiol. 2015 Feb;53(2):699-701. doi: 10.1128/JCM.03087-14.","J Clin Microbiol.  2015","PubMed","citation","PMID:25502524 | PMCID:PMC4298544","pubmed","25502524","create date:2014/12/17 | first author:Malatinkova E",
"Development of droplet digital PCR for the detection of Babesia microti and Babesia duncani.","/pubmed/25500215","Wilson M, Glaser KC, Adams-Fish D, Boley M, Mayda M, Molestina RE.","Exp Parasitol. 2015 Feb;149:24-31. doi: 10.1016/j.exppara.2014.12.003.","Exp Parasitol.  2015","PubMed","citation","PMID:25500215 | PMCID:PMC4314376","pubmed","25500215","create date:2014/12/17 | first author:Wilson M",
"High-throughput transcriptome analysis of barley (Hordeum vulgare) exposed to excessive boron.","/pubmed/25498907","Tombuloglu G, Tombuloglu H, Sakcali MS, Unver T.","Gene. 2015 Feb 15;557(1):71-81. doi: 10.1016/j.gene.2014.12.012.","Gene.  2015","PubMed","citation","PMID:25498907","pubmed","25498907","create date:2014/12/17 | first author:Tombuloglu G",
"Authentication of Ginkgo biloba herbal dietary supplements using DNA barcoding.","/pubmed/25495290","Little DP.","Genome. 2014 Sep;57(9):513-6. doi: 10.1139/gen-2014-0130.","Genome.  2014","PubMed","citation","PMID:25495290","pubmed","25495290","create date:2014/12/17 | first author:Little DP",
"Response of Caenorhabditis elegans to wireless devices radiation exposure.","/pubmed/25488006","Fasseas MK, Fragopoulou AF, Manta AK, Skouroliakou A, Vekrellis K, Margaritis LH, Syntichaki P.","Int J Radiat Biol. 2015 Mar;91(3):286-93. doi: 10.3109/09553002.2014.995384.","Int J Radiat Biol.  2015","PubMed","citation","PMID:25488006","pubmed","25488006","create date:2014/12/10 | first author:Fasseas MK",
"Quantification of circulating miRNAs by droplet digital PCR: comparison of EvaGreen- and TaqMan-based chemistries.","/pubmed/25472671","Miotto E, Saccenti E, Lupini L, Callegari E, Negrini M, Ferracin M.","Cancer Epidemiol Biomarkers Prev. 2014 Dec;23(12):2638-42. doi: 10.1158/1055-9965.EPI-14-0503.","Cancer Epidemiol Biomarkers Prev.  2014","PubMed","citation","PMID:25472671","pubmed","25472671","create date:2014/12/05 | first author:Miotto E",
"Species identification and quantification in meat and meat products using droplet digital PCR (ddPCR).","/pubmed/25466124","Floren C, Wiedemann I, Brenig B, Schütz E, Beck J.","Food Chem. 2015 Apr 15;173:1054-8. doi: 10.1016/j.foodchem.2014.10.138.","Food Chem.  2015","PubMed","citation","PMID:25466124","pubmed","25466124","create date:2014/12/04 | first author:Floren C",
"Past, present, and future perspectives on the diagnosis of Roseolovirus infections.","/pubmed/25462438","Hill JA, Sedlak RH, Jerome KR.","Curr Opin Virol. 2014 Dec;9:84-90. doi: 10.1016/j.coviro.2014.09.014. Review.","Curr Opin Virol.  2014","PubMed","citation","PMID:25462438 | PMCID:PMC4573551","pubmed","25462438","create date:2014/12/03 | first author:Hill JA",
"Hepatic nerve growth factor induced by iron overload triggers defenestration in liver sinusoidal endothelial cells.","/pubmed/25460199","Addo L, Tanaka H, Yamamoto M, Toki Y, Ito S, Ikuta K, Sasaki K, Ohtake T, Torimoto Y, Fujiya M, Kohgo Y.","Biochim Biophys Acta. 2015 Jan;1852(1):175-83. doi: 10.1016/j.bbadis.2014.11.014.","Biochim Biophys Acta.  2015","PubMed","citation","PMID:25460199","pubmed","25460199","create date:2014/12/03 | first author:Addo L",
"Stability of absolute copy number of housekeeping genes in preeclamptic and normal placentas, as measured by digital PCR.","/pubmed/25454476","Kaitu'u-Lino TJ, Hastie R, Cannon P, Lee S, Stock O, Hannan NJ, Hiscock R, Tong S.","Placenta. 2014 Dec;35(12):1106-9. doi: 10.1016/j.placenta.2014.10.003.","Placenta.  2014","PubMed","citation","PMID:25454476","pubmed","25454476","create date:2014/12/03 | first author:Kaitu'u-Lino TJ",
"Minimizing inhibition of PCR-STR typing using digital agarose droplet microfluidics.","/pubmed/25450795","Geng T, Mathies RA.","Forensic Sci Int Genet. 2015 Jan;14:203-9. doi: 10.1016/j.fsigen.2014.10.007.","Forensic Sci Int Genet.  2015","PubMed","citation","PMID:25450795","pubmed","25450795","create date:2014/12/03 | first author:Geng T",
"Skeletal muscle mitochondrial DNA deletions are not increased in CuZn-superoxide dismutase deficient mice.","/pubmed/25449857","Wanagat J, Ahmadieh N, Bielas JH, Ericson NG, Van Remmen H.","Exp Gerontol. 2015 Jan;61:15-9. doi: 10.1016/j.exger.2014.11.012.","Exp Gerontol.  2015","PubMed","citation","PMID:25449857 | PMCID:PMC4289650","pubmed","25449857","create date:2014/12/03 | first author:Wanagat J",
"RNA-Seq-based transcriptome analysis of dormant flower buds of Chinese cherry (Prunus pseudocerasus).","/pubmed/25447903","Zhu Y, Li Y, Xin D, Chen W, Shao X, Wang Y, Guo W.","Gene. 2015 Jan 25;555(2):362-76. doi: 10.1016/j.gene.2014.11.032.","Gene.  2015","PubMed","citation","PMID:25447903","pubmed","25447903","create date:2014/12/03 | first author:Zhu Y",
"IS6110-5'3'FP: an automated typing approach for Mycobacterium tuberculosis complex strains simultaneously targeting and resolving IS6110 5' and 3' polymorphisms.","/pubmed/25447727","Thabet S, Karboul A, Dekhil N, Mardassi H.","Int J Infect Dis. 2014 Dec;29:211-8. doi: 10.1016/j.ijid.2014.10.004.","Int J Infect Dis.  2014","PubMed","citation","PMID:25447727","pubmed","25447727","create date:2014/12/03 | first author:Thabet S",
"Clustering of clinical and environmental Escherichia coli O104 isolates using the DiversiLab™ repetitive sequence-based PCR system.","/pubmed/25447271","Herbold NM, Clotilde LM, Anderson KM, Kase J, Hartman GL, Himathongkham S, Lin A, Lauzon CR.","Curr Microbiol. 2015 Mar;70(3):436-40. doi: 10.1007/s00284-014-0728-z.","Curr Microbiol.  2015","PubMed","citation","PMID:25447271","pubmed","25447271","create date:2014/12/03 | first author:Herbold NM",
"Identification of a novel large deletion in a patient with severe factor V deficiency using an in-house F5 MLPA assay.","/pubmed/25438872","Nuzzo F, Paraboschi EM, Straniero L, Pavlova A, Duga S, Castoldi E.","Haemophilia. 2015 Jan;21(1):140-7. doi: 10.1111/hae.12536.","Haemophilia.  2015","PubMed","citation","PMID:25438872","pubmed","25438872","create date:2014/12/03 | first author:Nuzzo F",
"A comparison of DNA methylation specific droplet digital PCR (ddPCR) and real time qPCR with flow cytometry in characterizing human T cells in peripheral blood.","/pubmed/25437051","Wiencke JK, Bracci PM, Hsuang G, Zheng S, Hansen H, Wrensch MR, Rice T, Eliot M, Kelsey KT.","Epigenetics. 2014 Oct;9(10):1360-5. doi: 10.4161/15592294.2014.967589.","Epigenetics.  2014","PubMed","citation","PMID:25437051 | PMCID:PMC4622657","pubmed","25437051","create date:2014/12/02 | first author:Wiencke JK",
"Microfluidic continuous flow digital loop-mediated isothermal amplification (LAMP).","/pubmed/25431886","Rane TD, Chen L, Zec HC, Wang TH.","Lab Chip. 2015 Feb 7;15(3):776-82. doi: 10.1039/c4lc01158a.","Lab Chip.  2015","PubMed","citation","PMID:25431886 | PMCID:PMC4626017","pubmed","25431886","create date:2014/11/29 | first author:Rane TD",
"Computational intelligence-based polymerase chain reaction primer selection based on a novel teaching-learning-based optimisation.","/pubmed/25429503","Cheng YH.","IET Nanobiotechnol. 2014 Dec;8(4):238-46. doi: 10.1049/iet-nbt.2013.0055.","IET Nanobiotechnol.  2014","PubMed","citation","PMID:25429503","pubmed","25429503","create date:2014/11/28 | first author:Cheng YH",
"Digital dermatitis treponemes associated with a severe foot disease in dairy goats.","/pubmed/25428906","Sullivan LE, Evans NJ, Clegg SR, Carter SD, Horsfield JE, Grove-White D, Duncan JS.","Vet Rec. 2015 Mar 14;176(11):283. doi: 10.1136/vr.102858.","Vet Rec.  2015","PubMed","citation","PMID:25428906","pubmed","25428906","create date:2014/11/28 | first author:Sullivan LE",
"Allelic imbalance modulates surface expression of the tolerance-inducing HLA-G molecule on primary trophoblast cells.","/pubmed/25425608","Djurisic S, Teiblum S, Tolstrup CK, Christiansen OB, Hviid TV.","Mol Hum Reprod. 2015 Mar;21(3):281-95. doi: 10.1093/molehr/gau108.","Mol Hum Reprod.  2015","PubMed","citation","PMID:25425608","pubmed","25425608","create date:2014/11/27 | first author:Djurisic S",
"Assessing the accuracy of quantitative molecular microbial profiling.","/pubmed/25421243","O'Sullivan DM, Laver T, Temisak S, Redshaw N, Harris KA, Foy CA, Studholme DJ, Huggett JF.","Int J Mol Sci. 2014 Nov 21;15(11):21476-91. doi: 10.3390/ijms151121476.","Int J Mol Sci.  2014","PubMed","citation","PMID:25421243 | PMCID:PMC4264237","pubmed","25421243","create date:2014/11/26 | first author:O'Sullivan DM",
"Transcript profiling reveals auxin and cytokinin signaling pathways and transcription regulation during in vitro organogenesis of Ramie (Boehmeria nivea L. Gaud).","/pubmed/25415356","Huang X, Chen J, Bao Y, Liu L, Jiang H, An X, Dai L, Wang B, Peng D.","PLoS One. 2014 Nov 21;9(11):e113768. doi: 10.1371/journal.pone.0113768.","PLoS One.  2014","PubMed","citation","PMID:25415356 | PMCID:PMC4240604","pubmed","25415356","create date:2014/11/22 | first author:Huang X",
"Constructing protein-protein interaction network of hypertension with blood stasis syndrome via digital gene expression sequencing and database mining.","/pubmed/25412665","Lian YH, Fang MX, Chen LG.","J Integr Med. 2014 Nov;12(6):476-82. doi: 10.1016/S2095-4964(14)60058-3.","J Integr Med.  2014","PubMed","citation","PMID:25412665","pubmed","25412665","create date:2014/11/22 | first author:Lian YH",
"Quantitative cell-free circulating BRAFV600E mutation analysis by use of droplet digital PCR in the follow-up of patients with melanoma being treated with BRAF inhibitors.","/pubmed/25411185","Sanmamed MF, Fernández-Landázuri S, Rodríguez C, Zárate R, Lozano MD, Zubiri L, Perez-Gracia JL, Martín-Algarra S, González A.","Clin Chem. 2015 Jan;61(1):297-304. doi: 10.1373/clinchem.2014.230235.","Clin Chem.  2015","PubMed","citation","PMID:25411185","pubmed","25411185","create date:2014/11/21 | first author:Sanmamed MF",
"Research highlights: digital assays on chip.","/pubmed/25410901","Kim D, Wei Q, Kong JE, Ozcan A, Di Carlo D.","Lab Chip. 2015 Jan 7;15(1):17-22. doi: 10.1039/c4lc90119c.","Lab Chip.  2015","PubMed","citation","PMID:25410901","pubmed","25410901","create date:2014/11/21 | first author:Kim D",
"Quantification and dynamic monitoring of EGFR T790M in plasma cell-free DNA by digital PCR for prognosis of EGFR-TKI treatment in advanced NSCLC.","/pubmed/25405807","Wang Z, Chen R, Wang S, Zhong J, Wu M, Zhao J, Duan J, Zhuo M, An T, Wang Y, Bai H, Wang J.","PLoS One. 2014 Nov 18;9(11):e110780. doi: 10.1371/journal.pone.0110780.","PLoS One.  2014","PubMed","citation","PMID:25405807 | PMCID:PMC4236040","pubmed","25405807","create date:2014/11/19 | first author:Wang Z",
"Quantitative nucleic acid amplification methods for viral infections.","/pubmed/25403817","Gullett JC, Nolte FS.","Clin Chem. 2015 Jan;61(1):72-8. doi: 10.1373/clinchem.2014.223289. Review.","Clin Chem.  2015","PubMed","citation","PMID:25403817","pubmed","25403817","create date:2014/11/19 | first author:Gullett JC",
"Exon resequencing of H3K9 methyltransferase complex genes, EHMT1, EHTM2 and WIZ, in Japanese autism subjects.","/pubmed/25400900","Balan S, Iwayama Y, Maekawa M, Toyota T, Ohnishi T, Toyoshima M, Shimamoto C, Esaki K, Yamada K, Iwata Y, Suzuki K, Ide M, Ota M, Fukuchi S, Tsujii M, Mori N, Shinkai Y, Yoshikawa T.","Mol Autism. 2014 Oct 6;5(1):49. doi: 10.1186/2040-2392-5-49.","Mol Autism.  2014","PubMed","citation","PMID:25400900 | PMCID:PMC4233047","pubmed","25400900","create date:2014/11/18 | first author:Balan S",
"The impact of nevirapine- versus protease inhibitor-based regimens on virological markers of HIV-1 persistence during seemingly suppressive ART.","/pubmed/25397567","Kiselinova M, Anna M, Malatinkova E, Vervish K, Beloukas A, Messiaen P, Bonczkowski P, Trypsteen W, Callens S, Verhofstede C, De Spiegelaere W, Vandekerckhove L.","J Int AIDS Soc. 2014 Nov 2;17(4 Suppl 3):19823. doi: 10.7448/IAS.17.4.19823.","J Int AIDS Soc.  2014","PubMed","citation","PMID:25397567 | PMCID:PMC4225357","pubmed","25397567","create date:2014/11/15 | first author:Kiselinova M",
Title,URL,Description,Details,ShortDetails,Resource,Type,Identifiers,Db,EntrezUID,Properties
"Validation of an ultrasensitive digital droplet PCR assay for HIV-2 plasma RNA quantification.","/pubmed/25397425","Ruelle J, Yfantis V, Duquenne A, Goubau P.","J Int AIDS Soc. 2014 Nov 2;17(4 Suppl 3):19675. doi: 10.7448/IAS.17.4.19675.","J Int AIDS Soc.  2014","PubMed","citation","PMID:25397425 | PMCID:PMC4225411","pubmed","25397425","create date:2014/11/15 | first author:Ruelle J",
"Accurate episomal HIV 2-LTR circles quantification using optimized DNA isolation and droplet digital PCR.","/pubmed/25397424","Malatinkova E, Kiselinova M, Bonczkowski P, Trypsteen W, Messiaen P, Vermeire J, Verhasselt B, Vervisch K, Vandekerckhove L, De Spiegelaere W.","J Int AIDS Soc. 2014 Nov 2;17(4 Suppl 3):19674. doi: 10.7448/IAS.17.4.19674.","J Int AIDS Soc.  2014","PubMed","citation","PMID:25397424 | PMCID:PMC4225365","pubmed","25397424","create date:2014/11/15 | first author:Malatinkova E",
"Beneficial effect of a high number of copies of salivary amylase AMY1 gene on obesity risk in Mexican children.","/pubmed/25394825","Mejía-Benítez MA, Bonnefond A, Yengo L, Huyvaert M, Dechaume A, Peralta-Romero J, Klünder-Klünder M, García Mena J, El-Sayed Moustafa JS, Falchi M, Cruz M, Froguel P.","Diabetologia. 2015 Feb;58(2):290-4. doi: 10.1007/s00125-014-3441-3.","Diabetologia.  2015","PubMed","citation","PMID:25394825","pubmed","25394825","create date:2014/11/15 | first author:Mejía-Benítez MA",
"Standardization of Nucleic Acid Tests for Clinical Measurements of Bacteria and Viruses.","/pubmed/25392365","Pavšič J, Devonshire AS, Parkes H, Schimmel H, Foy CA, Karczmarczyk M, Gutiérrez-Aguirre I, Honeyborne I, Huggett JF, McHugh TD, Milavec M, Zeichhardt H, Žel J.","J Clin Microbiol. 2015 Jul;53(7):2008-14. doi: 10.1128/JCM.02136-14. Review.","J Clin Microbiol.  2015","PubMed","citation","PMID:25392365 | PMCID:PMC4473239","pubmed","25392365","create date:2014/11/14 | first author:Pavšič J",
"Self-digitization microfluidic chip for absolute quantification of mRNA in single cells.","/pubmed/25390242","Thompson AM, Gansen A, Paguirigan AL, Kreutz JE, Radich JP, Chiu DT.","Anal Chem. 2014 Dec 16;86(24):12308-14. doi: 10.1021/ac5035924.","Anal Chem.  2014","PubMed","citation","PMID:25390242 | PMCID:PMC4270397","pubmed","25390242","create date:2014/11/13 | first author:Thompson AM",
"Screening newborn blood spots for 22q11.2 deletion syndrome using multiplex droplet digital PCR.","/pubmed/25388430","Pretto D, Maar D, Yrigollen CM, Regan J, Tassone F.","Clin Chem. 2015 Jan;61(1):182-90. doi: 10.1373/clinchem.2014.230086.","Clin Chem.  2015","PubMed","citation","PMID:25388430","pubmed","25388430","create date:2014/11/13 | first author:Pretto D",
"Germ-line transmitted, chromosomally integrated HHV-6 and classical Hodgkin lymphoma.","/pubmed/25384040","Bell AJ, Gallagher A, Mottram T, Lake A, Kane EV, Lightfoot T, Roman E, Jarrett RF.","PLoS One. 2014 Nov 10;9(11):e112642. doi: 10.1371/journal.pone.0112642.","PLoS One.  2014","PubMed","citation","PMID:25384040 | PMCID:PMC4226568","pubmed","25384040","create date:2014/11/11 | first author:Bell AJ",
"Transgene detection by digital droplet PCR.","/pubmed/25375130","Moser DA, Braga L, Raso A, Zacchigna S, Giacca M, Simon P.","PLoS One. 2014 Nov 6;9(11):e111781. doi: 10.1371/journal.pone.0111781.","PLoS One.  2014","PubMed","citation","PMID:25375130 | PMCID:PMC4222945","pubmed","25375130","create date:2014/11/07 | first author:Moser DA",
"Next generation digital PCR measurement of hepatitis B virus copy number in formalin-fixed paraffin-embedded hepatocellular carcinoma tissue.","/pubmed/25361948","Huang JT, Liu YJ, Wang J, Xu ZG, Yang Y, Shen F, Liu XH, Zhou X, Liu SM.","Clin Chem. 2015 Jan;61(1):290-6. doi: 10.1373/clinchem.2014.230227.","Clin Chem.  2015","PubMed","citation","PMID:25361948","pubmed","25361948","create date:2014/11/02 | first author:Huang JT",
"Isolation of digital dermatitis treponemes from hoof lesions in Wild North American Elk (Cervus elaphus) in Washington State, USA.","/pubmed/25355757","Clegg SR, Mansfield KG, Newbrook K, Sullivan LE, Blowey RW, Carter SD, Evans NJ.","J Clin Microbiol. 2015 Jan;53(1):88-94. doi: 10.1128/JCM.02276-14.","J Clin Microbiol.  2015","PubMed","citation","PMID:25355757 | PMCID:PMC4290963","pubmed","25355757","create date:2014/10/31 | first author:Clegg SR",
"A droplet-to-digital (D2D) microfluidic device for single cell assays.","/pubmed/25354549","Shih SC, Gach PC, Sustarich J, Simmons BA, Adams PD, Singh S, Singh AK.","Lab Chip. 2015 Jan 7;15(1):225-36. doi: 10.1039/c4lc00794h.","Lab Chip.  2015","PubMed","citation","PMID:25354549","pubmed","25354549","create date:2014/10/31 | first author:Shih SC",
"Prognostic serum miRNA biomarkers associated with Alzheimer's disease shows concordance with neuropsychological and neuroimaging assessment.","/pubmed/25349172","Cheng L, Doecke JD, Sharples RA, Villemagne VL, Fowler CJ, Rembach A, Martins RN, Rowe CC, Macaulay SL, Masters CL, Hill AF; Australian Imaging, Biomarkers and Lifestyle (AIBL) Research Group..","Mol Psychiatry. 2015 Oct;20(10):1188-96. doi: 10.1038/mp.2014.127.","Mol Psychiatry.  2015","PubMed","citation","PMID:25349172","pubmed","25349172","create date:2014/10/29 | first author:Cheng L",
"Considerations for digital PCR as an accurate molecular diagnostic tool.","/pubmed/25338683","Huggett JF, Cowen S, Foy CA.","Clin Chem. 2015 Jan;61(1):79-88. doi: 10.1373/clinchem.2014.221366. Review.","Clin Chem.  2015","PubMed","citation","PMID:25338683","pubmed","25338683","create date:2014/10/24 | first author:Huggett JF",
"Absent expression of the osteoblast-specific maternally imprinted genes, DLX5 and DLX6, causes split hand/split foot malformation type I.","/pubmed/25332435","Rattanasopha S, Tongkobpetch S, Srichomthong C, Kitidumrongsook P, Suphapeetiporn K, Shotelersuk V.","J Med Genet. 2014 Dec;51(12):817-23. doi: 10.1136/jmedgenet-2014-102576.","J Med Genet.  2014","PubMed","citation","PMID:25332435","pubmed","25332435","create date:2014/10/22 | first author:Rattanasopha S",
"A comparison between droplet digital and quantitative PCR in the analysis of bacterial 16S load in lung tissue samples from control and COPD GOLD 2.","/pubmed/25329701","Sze MA, Abbasi M, Hogg JC, Sin DD.","PLoS One. 2014 Oct 16;9(10):e110351. doi: 10.1371/journal.pone.0110351.","PLoS One.  2014","PubMed","citation","PMID:25329701 | PMCID:PMC4199711","pubmed","25329701","create date:2014/10/21 | first author:Sze MA",
"A solvent replenishment solution for managing evaporation of biochemical reactions in air-matrix digital microfluidics devices.","/pubmed/25325619","Jebrail MJ, Renzi RF, Sinha A, Van De Vreugde J, Gondhalekar C, Ambriz C, Meagher RJ, Branda SS.","Lab Chip. 2015 Jan 7;15(1):151-8. doi: 10.1039/c4lc00703d.","Lab Chip.  2015","PubMed","citation","PMID:25325619","pubmed","25325619","create date:2014/10/18 | first author:Jebrail MJ",
"Prospective blinded study of BRAFV600E mutation detection in cell-free DNA of patients with systemic histiocytic disorders.","/pubmed/25324352","Hyman DM, Diamond EL, Vibat CR, Hassaine L, Poole JC, Patel M, Holley VR, Cabrilo G, Lu TT, Arcila ME, Chung YR, Rampal R, Lacouture ME, Rosen N, Meric-Bernstam F, Baselga J, Kurzrock R, Erlander MG, Janku F, Abdel-Wahab O.","Cancer Discov. 2015 Jan;5(1):64-71. doi: 10.1158/2159-8290.CD-14-0742.","Cancer Discov.  2015","PubMed","citation","PMID:25324352","pubmed","25324352","create date:2014/10/18 | first author:Hyman DM",
"Maternal age effect and severe germ-line bottleneck in the inheritance of human mitochondrial DNA.","/pubmed/25313049","Rebolledo-Jaramillo B, Su MS, Stoler N, McElhoe JA, Dickins B, Blankenberg D, Korneliussen TS, Chiaromonte F, Nielsen R, Holland MM, Paul IM, Nekrutenko A, Makova KD.","Proc Natl Acad Sci U S A. 2014 Oct 28;111(43):15474-9. doi: 10.1073/pnas.1409328111.","Proc Natl Acad Sci U S A.  2014","PubMed","citation","PMID:25313049 | PMCID:PMC4217420","pubmed","25313049","create date:2014/10/15 | first author:Rebolledo-Jaramillo B",
"Mapping the deletion endpoints in individuals with 22q11.2 deletion syndrome by droplet digital PCR.","/pubmed/25312060","Hwang VJ, Maar D, Regan J, Angkustsiri K, Simon TJ, Tassone F.","BMC Med Genet. 2014 Oct 14;15:106. doi: 10.1186/s12881-014-0106-5.","BMC Med Genet.  2014","PubMed","citation","PMID:25312060 | PMCID:PMC4258952","pubmed","25312060","create date:2014/10/15 | first author:Hwang VJ",
"Critical Role of IP-10 on Reducing Experimental Corneal Neovascularization.","/pubmed/25309995","Liu G, Zhang W, Xiao Y, Lu P.","Curr Eye Res. 2015 Sep;40(9):891-901. doi: 10.3109/02713683.2014.968934.","Curr Eye Res.  2015","PubMed","citation","PMID:25309995","pubmed","25309995","create date:2014/10/14 | first author:Liu G",
"Dietary influences on tissue concentrations of phytanic acid and AMACR expression in the benign human prostate.","/pubmed/25307752","Kataria Y, Wright M, Deaton RJ, Rueter EE, Rybicki BA, Moser AB, Ananthanrayanan V, Gann PH.","Prostate. 2015 Feb;75(2):200-10. doi: 10.1002/pros.22905.","Prostate.  2015","PubMed","citation","PMID:25307752 | PMCID:PMC4778716","pubmed","25307752","create date:2014/10/14 | first author:Kataria Y",
"Quantifying environmental DNA signals for aquatic invasive species across multiple detection platforms.","/pubmed/25299381","Nathan LM, Simmons M, Wegleitner BJ, Jerde CL, Mahon AR.","Environ Sci Technol. 2014 Nov 4;48(21):12800-6. doi: 10.1021/es5034052.","Environ Sci Technol.  2014","PubMed","citation","PMID:25299381","pubmed","25299381","create date:2014/10/10 | first author:Nathan LM",
"Transcriptome characterization analysis of Bactrocera minax and new insights into its pupal diapause development with gene expression analysis.","/pubmed/25285037","Dong Y, Desneux N, Lei C, Niu C.","Int J Biol Sci. 2014 Sep 12;10(9):1051-63. doi: 10.7150/ijbs.9438.","Int J Biol Sci.  2014","PubMed","citation","PMID:25285037 | PMCID:PMC4183925","pubmed","25285037","create date:2014/10/07 | first author:Dong Y",
"Emerging technologies for the clinical microbiology laboratory.","/pubmed/25278575","Buchan BW, Ledeboer NA.","Clin Microbiol Rev. 2014 Oct;27(4):783-822. doi: 10.1128/CMR.00003-14. Review.","Clin Microbiol Rev.  2014","PubMed","citation","PMID:25278575 | PMCID:PMC4187641","pubmed","25278575","create date:2014/10/04 | first author:Buchan BW",
"A multiplexed droplet digital PCR assay performs better than qPCR on inhibition prone samples.","/pubmed/25277746","Sedlak RH, Kuypers J, Jerome KR.","Diagn Microbiol Infect Dis. 2014 Dec;80(4):285-6. doi: 10.1016/j.diagmicrobio.2014.09.004.","Diagn Microbiol Infect Dis.  2014","PubMed","citation","PMID:25277746","pubmed","25277746","create date:2014/10/04 | first author:Sedlak RH",
"Deep sequencing of the scallop Chlamys farreri transcriptome response to tetrabromobisphenol A (TBBPA) stress.","/pubmed/25260812","Hu F, Pan L, Cai Y, Liu T, Jin Q.","Mar Genomics. 2015 Feb;19:31-8. doi: 10.1016/j.margen.2014.09.004.","Mar Genomics.  2015","PubMed","citation","PMID:25260812","pubmed","25260812","create date:2014/09/28 | first author:Hu F",
"Whole-genome sequencing identifies genetic variances in culture-expanded human mesenchymal stem cells.","/pubmed/25254336","Cai J, Miao X, Li Y, Smith C, Tsang K, Cheng L, Wang QF.","Stem Cell Reports. 2014 Aug 12;3(2):227-33. doi: 10.1016/j.stemcr.2014.05.019.","Stem Cell Reports.  2014","PubMed","citation","PMID:25254336 | PMCID:PMC4176531","pubmed","25254336","create date:2014/09/26 | first author:Cai J",
"Progesterone modulates SERCA2a expression and function in rabbit cardiomyocytes.","/pubmed/25252951","Moshal KS, Zhang Z, Roder K, Kim TY, Cooper L, Patedakis Litvinov B, Lu Y, Reddy V, Terentyev D, Choi BR, Koren G.","Am J Physiol Cell Physiol. 2014 Dec 1;307(11):C1050-7. doi: 10.1152/ajpcell.00127.2014.","Am J Physiol Cell Physiol.  2014","PubMed","citation","PMID:25252951 | PMCID:PMC4254949","pubmed","25252951","create date:2014/09/26 | first author:Moshal KS",
"Clinical relevance of KRAS-mutated subclones detected with picodroplet digital PCR in advanced colorectal cancer treated with anti-EGFR therapy.","/pubmed/25248381","Laurent-Puig P, Pekin D, Normand C, Kotsopoulos SK, Nizard P, Perez-Toralla K, Rowell R, Olson J, Srinivasan P, Le Corre D, Hor T, El Harrak Z, Li X, Link DR, Bouché O, Emile JF, Landi B, Boige V, Hutchison JB, Taly V.","Clin Cancer Res. 2015 Mar 1;21(5):1087-97. doi: 10.1158/1078-0432.CCR-14-0983.","Clin Cancer Res.  2015","PubMed","citation","PMID:25248381","pubmed","25248381","create date:2014/09/25 | first author:Laurent-Puig P",
"Digital gene expression analysis of reproductive toxicity of benzo[a]pyrene in male scallop chlamys farreri.","/pubmed/25244687","Deng X, Pan L, Miao J, Cai Y, Hu F.","Ecotoxicol Environ Saf. 2014 Dec;110:190-6. doi: 10.1016/j.ecoenv.2014.09.002.","Ecotoxicol Environ Saf.  2014","PubMed","citation","PMID:25244687","pubmed","25244687","create date:2014/09/23 | first author:Deng X",
"Quantitative analysis of pork and chicken products by droplet digital PCR.","/pubmed/25243184","Cai Y, Li X, Lv R, Yang J, Li J, He Y, Pan L.","Biomed Res Int. 2014;2014:810209. doi: 10.1155/2014/810209.","Biomed Res Int.  2014","PubMed","citation","PMID:25243184 | PMCID:PMC4163444","pubmed","25243184","create date:2014/09/23 | first author:Cai Y",
