Title,URL,Description,Details,ShortDetails,Resource,Type,Identifiers,Db,EntrezUID,Properties
"Nasal carriage of Staphylococcus aureus and Candida species in immunocompetent individuals.","/pubmed/23798081","Nastri ML, Hecht P, Nastri N, Jewtuchowicz V, Cuesta A, Estrugo J, Gualtieri A, Sordelli DO, Rosa A.","Acta Odontol Latinoam. 2012;25(3):324-9.","Acta Odontol Latinoam.  2012","PubMed","citation","PMID:23798081","pubmed","23798081","create date:2012/01/01 | first author:Nastri ML",
"Quantitative and Sensitive Detection of Cancer Genome Amplifications from Formalin Fixed Paraffin Embedded Tumors with Droplet Digital PCR.","/pubmed/23682346","Nadauld L, Regan JF, Miotke L, Pai RK, Longacre TA, Kwok SS, Saxonov S, Ford JM, Ji HP.","Transl Med (Sunnyvale). 2012;2(2). pii: 1000107.","Transl Med (Sunnyvale).  2012","PubMed","citation","PMID:23682346 | PMCID:PMC3653435","pubmed","23682346","create date:2012/01/01 | first author:Nadauld L",
"BRAF, GNAQ, and GNA11 mutations and copy number in pediatric low-grade glioma.","/pubmed/23650591","Laviv Y, Toledano H, Michowiz S, Dratviman-Storobinsky O, Turm Y, Fichman-Horn S, Kagnovski E, Goldenberg-Cohen N.","FEBS Open Bio. 2012 Jun 1;2:129-34. doi: 10.1016/j.fob.2012.05.004.","FEBS Open Bio.  2012","PubMed","citation","PMID:23650591 | PMCID:PMC3642131","pubmed","23650591","create date:2012/01/01 | first author:Laviv Y",
"Norcantharidin: a potential antiangiogenic agent for gallbladder cancers in vitro and in vivo.","/pubmed/22200632","Zhang JT, Fan YZ, Chen CQ, Zhao ZM, Sun W.","Int J Oncol. 2012 May;40(5):1501-14. doi: 10.3892/ijo.2011.1314.","Int J Oncol.  2012","PubMed","citation","PMID:22200632","pubmed","22200632","create date:2011/12/28 | first author:Zhang JT",
"Morphometric differentiation between camel and sheep strains of Echinococcus granulosus using computer image analysis system (CIAS).","/pubmed/22182645","Mowlavi G, Salehi M, Eshraghian M, Rokni MB, Fasihi-Harandi M, Mohajeran E, Salahi-Moghaddam A.","Asian Pac J Trop Med. 2012 Jan;5(1):58-61. doi: 10.1016/S1995-7645(11)60246-0.","Asian Pac J Trop Med.  2012","PubMed","citation","PMID:22182645","pubmed","22182645","create date:2011/12/21 | first author:Mowlavi G",
"Methods for small RNA preparation for digital gene expression profiling by next-generation sequencing.","/pubmed/22144201","Linsen SE, Cuppen E.","Methods Mol Biol. 2012;822:205-17. doi: 10.1007/978-1-61779-427-8_14.","Methods Mol Biol.  2012","PubMed","citation","PMID:22144201","pubmed","22144201","create date:2011/12/07 | first author:Linsen SE",
"A systematic analysis on DNA methylation and the expression of both mRNA and microRNA in bladder cancer.","/pubmed/22140553","Zhu J, Jiang Z, Gao F, Hu X, Zhou L, Chen J, Luo H, Sun J, Wu S, Han Y, Yin G, Chen M, Han Z, Li X, Huang Y, Zhang W, Zhou F, Chen T, Fa P, Wang Y, Sun L, Leng H, et al.","PLoS One. 2011;6(11):e28223. doi: 10.1371/journal.pone.0028223.","PLoS One.  2011","PubMed","citation","PMID:22140553 | PMCID:PMC3227661","pubmed","22140553","create date:2011/12/06 | first author:Zhu J",
"Multiplex DNA detection of food allergens on a digital versatile disk.","/pubmed/22126645","Tortajada-Genaro LA, Santiago-Felipe S, Morais S, Gabaldón JA, Puchades R, Maquieira Á.","J Agric Food Chem. 2012 Jan 11;60(1):36-43. doi: 10.1021/jf2037032.","J Agric Food Chem.  2012","PubMed","citation","PMID:22126645","pubmed","22126645","create date:2011/12/01 | first author:Tortajada-Genaro LA",
"Characterization of a novel human testis-specific gene: testis developmental related gene 1 (TDRG1).","/pubmed/22123530","Jiang X, Li D, Yang J, Wen J, Chen H, Xiao X, Dai Y, Yang J, Tang Y.","Tohoku J Exp Med. 2011;225(4):311-8.","Tohoku J Exp Med.  2011","PubMed","citation","PMID:22123530","pubmed","22123530","create date:2011/11/30 | first author:Jiang X",
"Evaluation of a droplet digital polymerase chain reaction format for DNA copy number quantification.","/pubmed/22122760","Pinheiro LB, Coleman VA, Hindson CM, Herrmann J, Hindson BJ, Bhat S, Emslie KR.","Anal Chem. 2012 Jan 17;84(2):1003-11. doi: 10.1021/ac202578x.","Anal Chem.  2012","PubMed","citation","PMID:22122760 | PMCID:PMC3260738","pubmed","22122760","create date:2011/11/30 | first author:Pinheiro LB",
"Novel cell lines established from pediatric brain tumors.","/pubmed/22120608","Xu J, Erdreich-Epstein A, Gonzalez-Gomez I, Melendez EY, Smbatyan G, Moats RA, Rosol M, Biegel JA, Reynolds CP.","J Neurooncol. 2012 Apr;107(2):269-80. doi: 10.1007/s11060-011-0756-5.","J Neurooncol.  2012","PubMed","citation","PMID:22120608 | PMCID:PMC3379550","pubmed","22120608","create date:2011/11/29 | first author:Xu J",
"Further improvement in quantifying male fetal DNA in maternal plasma.","/pubmed/22100805","Jin S, Lin XM, Law H, Kwek KY, Yeo GS, Ding C.","Clin Chem. 2012 Feb;58(2):465-8. doi: 10.1373/clinchem.2011.174417.","Clin Chem.  2012","PubMed","citation","PMID:22100805","pubmed","22100805","create date:2011/11/22 | first author:Jin S",
"Microbial diversity in bovine papillomatous digital dermatitis in Holstein dairy cows from upstate New York.","/pubmed/22093037","Santos TM, Pereira RV, Caixeta LS, Guard CL, Bicalho RC.","FEMS Microbiol Ecol. 2012 Feb;79(2):518-29. doi: 10.1111/j.1574-6941.2011.01234.x.","FEMS Microbiol Ecol.  2012","PubMed","citation","PMID:22093037","pubmed","22093037","create date:2011/11/19 | first author:Santos TM",
"Lack of CTGF*-945C/G Dimorphism in Thai Patients with Systemic Sclerosis.","/pubmed/22046208","Louthrenoo W, Kasitanon N, Wichainun R, Wangkaew S, Sukitawut W, Ohnogi Y, Kuwata S, Takeuchi F.","Open Rheumatol J. 2011;5:59-63. doi: 10.2174/1874312901105010059.","Open Rheumatol J.  2011","PubMed","citation","PMID:22046208 | PMCID:PMC3204428","pubmed","22046208","create date:2011/11/03 | first author:Louthrenoo W",
"High-throughput droplet digital PCR system for absolute quantitation of DNA copy number.","/pubmed/22035192","Hindson BJ, Ness KD, Masquelier DA, Belgrader P, Heredia NJ, Makarewicz AJ, Bright IJ, Lucero MY, Hiddessen AL, Legler TC, Kitano TK, Hodel MR, Petersen JF, Wyatt PW, Steenblock ER, Shah PH, Bousse LJ, Troup CB, Mellen JC, Wittmann DK, Erndt NG, Cauley TH, et al.","Anal Chem. 2011 Nov 15;83(22):8604-10. doi: 10.1021/ac202028g.","Anal Chem.  2011","PubMed","citation","PMID:22035192 | PMCID:PMC3216358","pubmed","22035192","create date:2011/11/01 | first author:Hindson BJ",
"Identification of genes associated with nitrogen-use efficiency by genome-wide transcriptional analysis of two soybean genotypes.","/pubmed/22029603","Hao QN, Zhou XA, Sha AH, Wang C, Zhou R, Chen SL.","BMC Genomics. 2011 Oct 26;12:525. doi: 10.1186/1471-2164-12-525.","BMC Genomics.  2011","PubMed","citation","PMID:22029603 | PMCID:PMC3210170","pubmed","22029603","create date:2011/10/28 | first author:Hao QN",
"Host and environmental reservoirs of infection for bovine digital dermatitis treponemes.","/pubmed/22019292","Evans NJ, Timofte D, Isherwood DR, Brown JM, Williams JM, Sherlock K, Lehane MJ, Murray RD, Birtles RJ, Hart CA, Carter SD.","Vet Microbiol. 2012 Apr 23;156(1-2):102-9. doi: 10.1016/j.vetmic.2011.09.029.","Vet Microbiol.  2012","PubMed","citation","PMID:22019292","pubmed","22019292","create date:2011/10/25 | first author:Evans NJ",
"Screening and identification of seed-specific genes using digital differential display tools combined with microarray data from common wheat.","/pubmed/22003838","Yang X, Xu H, Li W, Li L, Sun J, Li Y, Yan Y, Hu Y.","BMC Genomics. 2011 Oct 17;12:513. doi: 10.1186/1471-2164-12-513.","BMC Genomics.  2011","PubMed","citation","PMID:22003838 | PMCID:PMC3206523","pubmed","22003838","create date:2011/10/19 | first author:Yang X",
"DNA repair biomarkers predict response to neoadjuvant chemoradiotherapy in esophageal cancer.","/pubmed/22000749","Alexander BM, Wang XZ, Niemierko A, Weaver DT, Mak RH, Roof KS, Fidias P, Wain J, Choi NC.","Int J Radiat Oncol Biol Phys. 2012 May 1;83(1):164-71. doi: 10.1016/j.ijrobp.2011.05.033.","Int J Radiat Oncol Biol Phys.  2012","PubMed","citation","PMID:22000749","pubmed","22000749","create date:2011/10/18 | first author:Alexander BM",
"Implementing prenatal diagnosis based on cell-free fetal DNA: accurate identification of factors affecting fetal DNA yield.","/pubmed/21998643","Barrett AN, Zimmermann BG, Wang D, Holloway A, Chitty LS.","PLoS One. 2011;6(10):e25202. doi: 10.1371/journal.pone.0025202.","PLoS One.  2011","PubMed","citation","PMID:21998643 | PMCID:PMC3187716","pubmed","21998643","create date:2011/10/15 | first author:Barrett AN",
"Multiplexed quantification of nucleic acids with large dynamic range using multivolume digital RT-PCR on a rotational SlipChip tested with HIV and hepatitis C viral load.","/pubmed/21995644","Shen F, Sun B, Kreutz JE, Davydova EK, Du W, Reddy PL, Joseph LJ, Ismagilov RF.","J Am Chem Soc. 2011 Nov 9;133(44):17705-12. doi: 10.1021/ja2060116.","J Am Chem Soc.  2011","PubMed","citation","PMID:21995644 | PMCID:PMC3216675","pubmed","21995644","create date:2011/10/15 | first author:Shen F",
"Detection of Neisseria meningitidis in cerebrospinal fluid using a multiplex PCR and the Luminex detection technology.","/pubmed/21993638","Møller JK.","Methods Mol Biol. 2012;799:37-53. doi: 10.1007/978-1-61779-346-2_3.","Methods Mol Biol.  2012","PubMed","citation","PMID:21993638","pubmed","21993638","create date:2011/10/14 | first author:Møller JK",
"Association between genetic variants in glutathione peroxidase 1 (GPx1) gene, GPx activity and the risk of prostate cancer.","/pubmed/21993316","Kucukgergin C, Gokpinar M, Sanli O, Tefik T, Oktar T, Seckin S.","Minerva Urol Nefrol. 2011 Sep;63(3):183-90.","Minerva Urol Nefrol.  2011","PubMed","citation","PMID:21993316","pubmed","21993316","create date:2011/10/14 | first author:Kucukgergin C",
"Digital PCR provides absolute quantitation of viral load for an occult RNA virus.","/pubmed/21983150","White RA 3rd, Quake SR, Curr K.","J Virol Methods. 2012 Jan;179(1):45-50. doi: 10.1016/j.jviromet.2011.09.017.","J Virol Methods.  2012","PubMed","citation","PMID:21983150","pubmed","21983150","create date:2011/10/11 | first author:White RA 3rd",
"Theoretical design and analysis of multivolume digital assays with wide dynamic range validated experimentally with microfluidic digital PCR.","/pubmed/21981344","Kreutz JE, Munson T, Huynh T, Shen F, Du W, Ismagilov RF.","Anal Chem. 2011 Nov 1;83(21):8158-68. doi: 10.1021/ac201658s.","Anal Chem.  2011","PubMed","citation","PMID:21981344 | PMCID:PMC3216679","pubmed","21981344","create date:2011/10/11 | first author:Kreutz JE",
"1-Million droplet array with wide-field fluorescence imaging for digital PCR.","/pubmed/21959960","Hatch AC, Fisher JS, Tovar AR, Hsieh AT, Lin R, Pentoney SL, Yang DL, Lee AP.","Lab Chip. 2011 Nov 21;11(22):3838-45. doi: 10.1039/c1lc20561g.","Lab Chip.  2011","PubMed","citation","PMID:21959960","pubmed","21959960","create date:2011/10/01 | first author:Hatch AC",
"Selective involvement of ERK and JNK mitogen-activated protein kinases in early rheumatoid arthritis (1987 ACR criteria compared to 2010 ACR/EULAR criteria): a prospective study aimed at identification of diagnostic and prognostic biomarkers as well as therapeutic targets.","/pubmed/21953337","de Launay D, van de Sande MG, de Hair MJ, Grabiec AM, van de Sande GP, Lehmann KA, Wijbrandts CA, van Baarsen LG, Gerlag DM, Tak PP, Reedquist KA.","Ann Rheum Dis. 2012 Mar;71(3):415-23. doi: 10.1136/ard.2010.143529.","Ann Rheum Dis.  2012","PubMed","citation","PMID:21953337 | PMCID:PMC3277721","pubmed","21953337","create date:2011/09/29 | first author:de Launay D",
"Digital hypothermia inhibits early lamellar inflammatory signalling in the oligofructose laminitis model.","/pubmed/21895750","van Eps AW, Leise BS, Watts M, Pollitt CC, Belknap JK.","Equine Vet J. 2012 Mar;44(2):230-7. doi: 10.1111/j.2042-3306.2011.00416.x.","Equine Vet J.  2012","PubMed","citation","PMID:21895750","pubmed","21895750","create date:2011/09/08 | first author:van Eps AW",
"Allelic discrimination of cis-trans relationships by digital polymerase chain reaction: GJB2 (p.V27I/p.E114G) and CFTR (p.R117H/5T).","/pubmed/21836520","Chen N, Schrijver I.","Genet Med. 2011 Dec;13(12):1025-31. doi: 10.1097/GIM.0b013e3182272e0b.","Genet Med.  2011","PubMed","citation","PMID:21836520","pubmed","21836520","create date:2011/08/13 | first author:Chen N",
"Whole transcriptome profiling of successful immune response to Vibrio infections in the oyster Crassostrea gigas by digital gene expression analysis.","/pubmed/21829707","de Lorgeril J, Zenagui R, Rosa RD, Piquemal D, Bachère E.","PLoS One. 2011;6(8):e23142. doi: 10.1371/journal.pone.0023142.","PLoS One.  2011","PubMed","citation","PMID:21829707 | PMCID:PMC3150398","pubmed","21829707","create date:2011/08/11 | first author:de Lorgeril J",
"[Effect of ginsenoside Rg1 on the spatial learning-memory ability in dementia rats after transplanted with bone marrow mesenchymal stem cells].","/pubmed/21823427","Wu W, Yang JQ, He ZY.","Zhongguo Zhong Xi Yi Jie He Za Zhi. 2011 Jun;31(6):799-802. Chinese. ","Zhongguo Zhong Xi Yi Jie He Za Zhi.  2011","PubMed","citation","PMID:21823427","pubmed","21823427","create date:2011/08/10 | first author:Wu W",
"Genome-wide identification, classification, and expression analysis of autophagy-associated gene homologues in rice (Oryza sativa L.).","/pubmed/21795261","Xia K, Liu T, Ouyang J, Wang R, Fan T, Zhang M.","DNA Res. 2011 Oct;18(5):363-77. doi: 10.1093/dnares/dsr024.","DNA Res.  2011","PubMed","citation","PMID:21795261 | PMCID:PMC3190957","pubmed","21795261","create date:2011/07/29 | first author:Xia K",
"Evaluation of O6-methylguanine-DNA methyltransferase by immunohistochemistry: best clinical and research practices.","/pubmed/21767920","Neto JC, Carvalho K, Olivieri E, Carraro D, Cunha I, Vassallo J, Kagohara L, Soares F, Rocha R.","Pathol Res Pract. 2011 Aug 15;207(8):492-7. doi: 10.1016/j.prp.2011.06.003.","Pathol Res Pract.  2011","PubMed","citation","PMID:21767920","pubmed","21767920","create date:2011/07/20 | first author:Neto JC",
"Digital karyotyping reveals probable target genes at 7q21.3 locus in hepatocellular carcinoma.","/pubmed/21767414","Dong H, Zhang H, Liang J, Yan H, Chen Y, Shen Y, Kong Y, Wang S, Zhao G, Jin W.","BMC Med Genomics. 2011 Jul 19;4:60. doi: 10.1186/1755-8794-4-60.","BMC Med Genomics.  2011","PubMed","citation","PMID:21767414 | PMCID:PMC3152898","pubmed","21767414","create date:2011/07/20 | first author:Dong H",
"Identification of immunogenic proteins in Treponema phagedenis-like strain V1 from digital dermatitis lesions by phage display.","/pubmed/21763087","Rosander A, Guss B, Frykberg L, Björkman C, Näslund K, Pringle M.","Vet Microbiol. 2011 Dec 15;153(3-4):315-22. doi: 10.1016/j.vetmic.2011.06.005.","Vet Microbiol.  2011","PubMed","citation","PMID:21763087","pubmed","21763087","create date:2011/07/19 | first author:Rosander A",
"Megapixel digital PCR.","/pubmed/21725299","Heyries KA, Tropini C, Vaninsberghe M, Doolin C, Petriv OI, Singhal A, Leung K, Hughesman CB, Hansen CL.","Nat Methods. 2011 Jul 3;8(8):649-51. doi: 10.1038/nmeth.1640.","Nat Methods.  2011","PubMed","citation","PMID:21725299","pubmed","21725299","create date:2011/07/05 | first author:Heyries KA",
"Probing individual environmental bacteria for viruses by using microfluidic digital PCR.","/pubmed/21719670","Tadmor AD, Ottesen EA, Leadbetter JR, Phillips R.","Science. 2011 Jul 1;333(6038):58-62. doi: 10.1126/science.1200758.","Science.  2011","PubMed","citation","PMID:21719670 | PMCID:PMC3261838","pubmed","21719670","create date:2011/07/02 | first author:Tadmor AD",
"Advances in transfusion medicine in the first decade of the 21st century: Advances in miniaturized technologies.","/pubmed/21715229","Petrik J, Coste J, Fournier-Wirth C.","Transfus Apher Sci. 2011 Aug;45(1):45-51. doi: 10.1016/j.transci.2011.06.002. Review.","Transfus Apher Sci.  2011","PubMed","citation","PMID:21715229","pubmed","21715229","create date:2011/07/01 | first author:Petrik J",
"Tunable 3D droplet self-assembly for ultra-high-density digital micro-reactor arrays.","/pubmed/21670837","Hatch AC, Fisher JS, Pentoney SL, Yang DL, Lee AP.","Lab Chip. 2011 Aug 7;11(15):2509-17. doi: 10.1039/c0lc00553c.","Lab Chip.  2011","PubMed","citation","PMID:21670837","pubmed","21670837","create date:2011/06/15 | first author:Hatch AC",
"Telomere length measurement-caveats and a critical assessment of the available technologies and tools.","/pubmed/21663926","Aubert G, Hills M, Lansdorp PM.","Mutat Res. 2012 Feb 1;730(1-2):59-67. doi: 10.1016/j.mrfmmm.2011.04.003. Review.","Mutat Res.  2012","PubMed","citation","PMID:21663926 | PMCID:PMC3460641","pubmed","21663926","create date:2011/06/15 | first author:Aubert G",
"PCR-free digital minisatellite tandem repeat genotyping.","/pubmed/21626523","Chen Y, Seo TS.","Electrophoresis. 2011 Jun;32(12):1456-64. doi: 10.1002/elps.201100073.","Electrophoresis.  2011","PubMed","citation","PMID:21626523","pubmed","21626523","create date:2011/06/01 | first author:Chen Y",
"Habitual exercise increases resistance of lymphocytes to oxidant-induced DNA damage by upregulating expression of antioxidant and DNA repairing enzymes.","/pubmed/21622964","Siu PM, Pei XM, Teng BT, Benzie IF, Ying M, Wong SH.","Exp Physiol. 2011 Sep;96(9):889-906. doi: 10.1113/expphysiol.2011.058396.","Exp Physiol.  2011","PubMed","citation","PMID:21622964","pubmed","21622964","create date:2011/05/31 | first author:Siu PM",
"Combining urinary detection of TMPRSS2:ERG and PCA3 with serum PSA to predict diagnosis of prostate cancer.","/pubmed/21600800","Salami SS, Schmidt F, Laxman B, Regan MM, Rickman DS, Scherr D, Bueti G, Siddiqui J, Tomlins SA, Wei JT, Chinnaiyan AM, Rubin MA, Sanda MG.","Urol Oncol. 2013 Jul;31(5):566-71. doi: 10.1016/j.urolonc.2011.04.001.","Urol Oncol.  2013","PubMed","citation","PMID:21600800 | PMCID:PMC3210917","pubmed","21600800","create date:2011/05/24 | first author:Salami SS",
"Quantitative and sensitive detection of rare mutations using droplet-based microfluidics.","/pubmed/21594292","Pekin D, Skhiri Y, Baret JC, Le Corre D, Mazutis L, Salem CB, Millot F, El Harrak A, Hutchison JB, Larson JW, Link DR, Laurent-Puig P, Griffiths AD, Taly V.","Lab Chip. 2011 Jul 7;11(13):2156-66. doi: 10.1039/c1lc20128j.","Lab Chip.  2011","PubMed","citation","PMID:21594292","pubmed","21594292","create date:2011/05/20 | first author:Pekin D",
"Multiplex digital PCR: breaking the one target per color barrier of quantitative PCR.","/pubmed/21584334","Zhong Q, Bhattacharya S, Kotsopoulos S, Olson J, Taly V, Griffiths AD, Link DR, Larson JW.","Lab Chip. 2011 Jul 7;11(13):2167-74. doi: 10.1039/c1lc20126c.","Lab Chip.  2011","PubMed","citation","PMID:21584334","pubmed","21584334","create date:2011/05/18 | first author:Zhong Q",
"Increased risk of advanced prostate cancer associated with MnSOD Ala-9-Val gene polymorphism.","/pubmed/21553226","Kucukgergin C, Sanli O, Tefik T, Aydın M, Ozcan F, Seckin S.","Mol Biol Rep. 2012 Jan;39(1):193-8. doi: 10.1007/s11033-011-0725-2.","Mol Biol Rep.  2012","PubMed","citation","PMID:21553226","pubmed","21553226","create date:2011/05/10 | first author:Kucukgergin C",
"[Identification of medical Dendrobium herbs by ISSR marker].","/pubmed/21548356","Yang LC, Deng H, Yi Y, Zhang XM, Wang YZ, Lin JQ.","Zhong Yao Cai. 2010 Dec;33(12):1841-4. Chinese. ","Zhong Yao Cai.  2010","PubMed","citation","PMID:21548356","pubmed","21548356","create date:2011/05/10 | first author:Yang LC",
"Determination of fetal chromosome aberrations from fetal DNA in maternal blood: has the challenge finally been met?","/pubmed/21542948","Hahn S, Lapaire O, Tercanli S, Kolla V, Hösli I.","Expert Rev Mol Med. 2011 May 4;13:e16. doi: 10.1017/S1462399411001852. Review.","Expert Rev Mol Med.  2011","PubMed","citation","PMID:21542948 | PMCID:PMC3087311","pubmed","21542948","create date:2011/05/06 | first author:Hahn S",
"Hydroxysafflor yellow A protects against chronic carbon tetrachloride-induced liver fibrosis.","/pubmed/21536026","Zhang Y, Guo J, Dong H, Zhao X, Zhou L, Li X, Liu J, Niu Y.","Eur J Pharmacol. 2011 Jun 25;660(2-3):438-44. doi: 10.1016/j.ejphar.2011.04.015.","Eur J Pharmacol.  2011","PubMed","citation","PMID:21536026","pubmed","21536026","create date:2011/05/04 | first author:Zhang Y",
Title,URL,Description,Details,ShortDetails,Resource,Type,Identifiers,Db,EntrezUID,Properties
"A three-gene panel on urine increases PSA specificity in the detection of prostate cancer.","/pubmed/21520154","Rigau M, Ortega I, Mir MC, Ballesteros C, Garcia M, Llauradó M, Colás E, Pedrola N, Montes M, Sequeiros T, Ertekin T, Majem B, Planas J, Ruiz A, Abal M, Sánchez A, Morote J, Reventós J, Doll A.","Prostate. 2011 Dec;71(16):1736-45. doi: 10.1002/pros.21390.","Prostate.  2011","PubMed","citation","PMID:21520154","pubmed","21520154","create date:2011/04/27 | first author:Rigau M",
"Current issues in the clinical management of invasive aspergillosis--the AGIHO, DMykG, ÖGMM and PEG web-based survey and expert consensus conference 2009.","/pubmed/21518025","Rüping MJ, Vehreschild JJ, Groll A, Lass-Flörl C, Ostermann H, Ruhnke M, Cornely OA.","Mycoses. 2011 Sep;54(5):e557-68. doi: 10.1111/j.1439-0507.2010.01989.x.","Mycoses.  2011","PubMed","citation","PMID:21518025","pubmed","21518025","create date:2011/04/27 | first author:Rüping MJ",
"Digital analysis of the expression levels of multiple colorectal cancer-related genes by multiplexed digital-PCR coupled with hydrogel bead-array.","/pubmed/21509397","Qi Z, Ma Y, Deng L, Wu H, Zhou G, Kajiyama T, Kambara H.","Analyst. 2011 Jun 7;136(11):2252-9. doi: 10.1039/c0an00976h.","Analyst.  2011","PubMed","citation","PMID:21509397","pubmed","21509397","create date:2011/04/22 | first author:Qi Z",
"Genomic evidence of pre-invasive clonal expansion, dispersal and progression in bronchial dysplasia.","/pubmed/21506132","McCaughan F, Pipinikas CP, Janes SM, George PJ, Rabbitts PH, Dear PH.","J Pathol. 2011 Jun;224(2):153-9. doi: 10.1002/path.2887.","J Pathol.  2011","PubMed","citation","PMID:21506132 | PMCID:PMC3378694","pubmed","21506132","create date:2011/04/21 | first author:McCaughan F",
"Second-generation sequencing supply an effective way to screen RNAi targets in large scale for potential application in pest insect control.","/pubmed/21494551","Wang Y, Zhang H, Li H, Miao X.","PLoS One. 2011 Apr 11;6(4):e18644. doi: 10.1371/journal.pone.0018644.","PLoS One.  2011","PubMed","citation","PMID:21494551 | PMCID:PMC3073972","pubmed","21494551","create date:2011/04/16 | first author:Wang Y",
"Association between bovine digital dermatitis treponemes and a range of 'non-healing' bovine hoof disorders.","/pubmed/21493554","Evans NJ, Blowey RW, Timofte D, Isherwood DR, Brown JM, Murray R, Paton RJ, Carter SD.","Vet Rec. 2011 Feb 26;168(8):214. doi: 10.1136/vr.c5487.","Vet Rec.  2011","PubMed","citation","PMID:21493554","pubmed","21493554","create date:2011/04/16 | first author:Evans NJ",
"Somatic/gonadal mosaicism in a syndromic form of ectrodactyly, including eye abnormalities, documented through array-based comparative genomic hybridization.","/pubmed/21485001","Filho AB, Souza J, Faucz FR, Sotomaior VS, Dupont B, Bartel F, Rodriguez R, Schwartz CE, Skinner C, Alliman S, Raskin S.","Am J Med Genet A. 2011 May;155A(5):1152-6. doi: 10.1002/ajmg.a.33942.","Am J Med Genet A.  2011","PubMed","citation","PMID:21485001","pubmed","21485001","create date:2011/04/13 | first author:Filho AB",
"Digital isothermal quantification of nucleic acids via simultaneous chemical initiation of recombinase polymerase amplification reactions on SlipChip.","/pubmed/21476587","Shen F, Davydova EK, Du W, Kreutz JE, Piepenburg O, Ismagilov RF.","Anal Chem. 2011 May 1;83(9):3533-40. doi: 10.1021/ac200247e.","Anal Chem.  2011","PubMed","citation","PMID:21476587 | PMCID:PMC3101872","pubmed","21476587","create date:2011/04/12 | first author:Shen F",
"Digital multiplexed gene expression analysis using the NanoString nCounter system.","/pubmed/21472696","Kulkarni MM.","Curr Protoc Mol Biol. 2011 Apr;Chapter 25:Unit25B.10. doi: 10.1002/0471142727.mb25b10s94.","Curr Protoc Mol Biol.  2011","PubMed","citation","PMID:21472696","pubmed","21472696","create date:2011/04/08 | first author:Kulkarni MM",
"Molecular, histologic, and trace mineral characterization of metacarpophalangeal and metatarsophalangeal joint hyperextension in juvenile llamas.","/pubmed/21453157","Semevolos SA, Reed SK.","Am J Vet Res. 2011 Apr;72(4):550-5. doi: 10.2460/ajvr.72.4.550.","Am J Vet Res.  2011","PubMed","citation","PMID:21453157","pubmed","21453157","create date:2011/04/02 | first author:Semevolos SA",
"Evaluation of digital PCR for absolute DNA quantification.","/pubmed/21446772","Sanders R, Huggett JF, Bushell CA, Cowen S, Scott DJ, Foy CA.","Anal Chem. 2011 Sep 1;83(17):6474-84. doi: 10.1021/ac103230c.","Anal Chem.  2011","PubMed","citation","PMID:21446772","pubmed","21446772","create date:2011/03/31 | first author:Sanders R",
"RNA sequencing and quantitation using the Helicos Genetic Analysis System.","/pubmed/21431761","Raz T, Causey M, Jones DR, Kieu A, Letovsky S, Lipson D, Thayer E, Thompson JF, Milos PM.","Methods Mol Biol. 2011;733:37-49. doi: 10.1007/978-1-61779-089-8_3.","Methods Mol Biol.  2011","PubMed","citation","PMID:21431761","pubmed","21431761","create date:2011/03/25 | first author:Raz T",
"[Genetic research about Mycobacterium avium complex].","/pubmed/21404652","Ogawa K.","Kekkaku. 2011 Feb;86(2):61-8. Japanese. ","Kekkaku.  2011","PubMed","citation","PMID:21404652","pubmed","21404652","create date:2011/03/17 | first author:Ogawa K",
